{
  "command": "review",
  "findings": [
    {
      "category": "test-gap",
      "consensus_level": null,
      "consensus_score": null,
      "detected_by": [
        "claude"
      ],
      "duplicate_cluster_id": null,
      "file_path": "plans/swarm-do-1.12-orchestration-friction-fixes.md",
      "finding_id": "01KQ0DCXY81ZH21VPQ4G82418D",
      "issue_id": "mco-1.12-00",
      "line_end": 282,
      "line_start": 282,
      "provider": "mco",
      "provider_count": 1,
      "provider_error_class": null,
      "role": "agent-codex-review",
      "run_id": "MCO_112_00",
      "schema_ok": true,
      "severity": "critical",
      "short_summary": "PreCompact-hook reliability is an unvalidated gating assumption, yet 1.12a DoD depends on it",
      "source_artifact_path": "/Users/mstefanko/.claude/plugins/marketplaces/mstefanko-plugins/swarm-do/data/mco-spike/1.12/results/01-context-resilience.md/mco.stdout.json",
      "stable_finding_hash_v1": "34a5b6f7176dfe99b2e57ecccec4d3e3e8a82d2aad795aa4581367dc946cb8f7",
      "summary": "PreCompact-hook reliability is an unvalidated gating assumption, yet 1.12a DoD depends on it",
      "timestamp": "2026-04-24T18:52:54Z"
    },
    {
      "category": "maintainability",
      "consensus_level": null,
      "consensus_score": null,
      "detected_by": [
        "claude"
      ],
      "duplicate_cluster_id": null,
      "file_path": "plans/swarm-do-1.12-orchestration-friction-fixes.md",
      "finding_id": "01KQ0DCXYE8DEJ1PQK300J2QAV",
      "issue_id": "mco-1.12-00",
      "line_end": 250,
      "line_start": 250,
      "provider": "mco",
      "provider_count": 1,
      "provider_error_class": null,
      "role": "agent-codex-review",
      "run_id": "MCO_112_00",
      "schema_ok": true,
      "severity": "high",
      "short_summary": "identity scheme is under-specified: run_id is per-swarm-run invocation, not per-pipeline",
      "source_artifact_path": "/Users/mstefanko/.claude/plugins/marketplaces/mstefanko-plugins/swarm-do/data/mco-spike/1.12/results/01-context-resilience.md/mco.stdout.json",
      "stable_finding_hash_v1": "94af790096306e7ee377ea29090d301b3863218ec6b3b3aa827d3a27c79a2f5b",
      "summary": "Resume identity scheme is under-specified: run_id is per-swarm-run invocation, not per-pipeline",
      "timestamp": "2026-04-24T18:52:54Z"
    },
    {
      "category": "maintainability",
      "consensus_level": null,
      "consensus_score": null,
      "detected_by": [
        "claude"
      ],
      "duplicate_cluster_id": null,
      "file_path": "plans/swarm-do-1.12-orchestration-friction-fixes.md",
      "finding_id": "01KQ0DCXYKPKGAGGDEYN1GK931",
      "issue_id": "mco-1.12-00",
      "line_end": 294,
      "line_start": 294,
      "provider": "mco",
      "provider_count": 1,
      "provider_error_class": null,
      "role": "agent-codex-review",
      "run_id": "MCO_112_00",
      "schema_ok": true,
      "severity": "high",
      "short_summary": "runs.v2 vs companion run_events.v1.jsonl is left as an either/or \u2014 a frozen-schema decision that blocks implementation",
      "source_artifact_path": "/Users/mstefanko/.claude/plugins/marketplaces/mstefanko-plugins/swarm-do/data/mco-spike/1.12/results/01-context-resilience.md/mco.stdout.json",
      "stable_finding_hash_v1": "650e1b58804cea18b65fc5287b1b541d29bbe06ff5412001bcb004f54e6db312",
      "summary": "runs.v2 vs companion run_events.v1.jsonl is left as an either/or \u2014 a frozen-schema decision that blocks implementation",
      "timestamp": "2026-04-24T18:52:54Z"
    },
    {
      "category": "maintainability",
      "consensus_level": null,
      "consensus_score": null,
      "detected_by": [
        "claude"
      ],
      "duplicate_cluster_id": null,
      "file_path": "plans/swarm-do-1.12-orchestration-friction-fixes.md",
      "finding_id": "01KQ0DCXYVYX5BTS0XTRF98Y1Q",
      "issue_id": "mco-1.12-00",
      "line_end": 285,
      "line_start": 285,
      "provider": "mco",
      "provider_count": 1,
      "provider_error_class": null,
      "role": "agent-codex-review",
      "run_id": "MCO_112_00",
      "schema_ok": true,
      "severity": "high",
      "short_summary": "BEADS-vs-checkpoint state authority is asserted but the mirror contract and drift algorithm are absent",
      "source_artifact_path": "/Users/mstefanko/.claude/plugins/marketplaces/mstefanko-plugins/swarm-do/data/mco-spike/1.12/results/01-context-resilience.md/mco.stdout.json",
      "stable_finding_hash_v1": "0260c6bf82fa62721c306e4bbd3f589db9cca2584df24220e631301007fa4abc",
      "summary": "BEADS-vs-checkpoint state authority is asserted but the mirror contract and drift algorithm are absent",
      "timestamp": "2026-04-24T18:52:54Z"
    },
    {
      "category": "bug",
      "consensus_level": null,
      "consensus_score": null,
      "detected_by": [
        "claude"
      ],
      "duplicate_cluster_id": null,
      "file_path": "plans/swarm-do-1.12-orchestration-friction-fixes.md",
      "finding_id": "01KQ0DCXYZRAZSC7YJBJPHW1MD",
      "issue_id": "mco-1.12-00",
      "line_end": 184,
      "line_start": 184,
      "provider": "mco",
      "provider_count": 1,
      "provider_error_class": null,
      "role": "agent-codex-review",
      "run_id": "MCO_112_00",
      "schema_ok": true,
      "severity": "high",
      "short_summary": "token/tool-call watchdog has no viable observation channel into a running Claude Agent()",
      "source_artifact_path": "/Users/mstefanko/.claude/plugins/marketplaces/mstefanko-plugins/swarm-do/data/mco-spike/1.12/results/01-context-resilience.md/mco.stdout.json",
      "stable_finding_hash_v1": "de5ff204881aa89a035c7c9389cf1058b63013f15f55512fbd20e9e13960769d",
      "summary": "Writer token/tool-call watchdog has no viable observation channel into a running Claude Agent()",
      "timestamp": "2026-04-24T18:52:54Z"
    },
    {
      "category": "bug",
      "consensus_level": null,
      "consensus_score": null,
      "detected_by": [
        "claude"
      ],
      "duplicate_cluster_id": null,
      "file_path": "plans/swarm-do-1.12-orchestration-friction-fixes.md",
      "finding_id": "01KQ0DCXZ4HHZ0RXV7Z9QD1XV7",
      "issue_id": "mco-1.12-00",
      "line_end": 189,
      "line_start": 189,
      "provider": "mco",
      "provider_count": 1,
      "provider_error_class": null,
      "role": "agent-codex-review",
      "run_id": "MCO_112_00",
      "schema_ok": true,
      "severity": "high",
      "short_summary": "HANDOFF_REQUESTED marker has no defined channel or schema",
      "source_artifact_path": "/Users/mstefanko/.claude/plugins/marketplaces/mstefanko-plugins/swarm-do/data/mco-spike/1.12/results/01-context-resilience.md/mco.stdout.json",
      "stable_finding_hash_v1": "5ed0d2024c93e27c7967fc41b8d1c8a2a83c7dba7636c653f5a4784af38e2528",
      "summary": "HANDOFF_REQUESTED marker has no defined channel or schema",
      "timestamp": "2026-04-24T18:52:54Z"
    },
    {
      "category": "bug",
      "consensus_level": null,
      "consensus_score": null,
      "detected_by": [
        "claude"
      ],
      "duplicate_cluster_id": null,
      "file_path": "plans/swarm-do-1.12-orchestration-friction-fixes.md",
      "finding_id": "01KQ0DCXZ9YJSBQ3GKZK00D1PF",
      "issue_id": "mco-1.12-00",
      "line_end": 230,
      "line_start": 230,
      "provider": "mco",
      "provider_count": 1,
      "provider_error_class": null,
      "role": "agent-codex-review",
      "run_id": "MCO_112_00",
      "schema_ok": true,
      "severity": "high",
      "short_summary": "Observer-as-hook (N3) cannot observe swarm-run Codex subprocesses or worktree writer subagents",
      "source_artifact_path": "/Users/mstefanko/.claude/plugins/marketplaces/mstefanko-plugins/swarm-do/data/mco-spike/1.12/results/01-context-resilience.md/mco.stdout.json",
      "stable_finding_hash_v1": "3ba29911b74b5515f682cb530b69f0440973a68b30a23e2ee702e60801984759",
      "summary": "Observer-as-hook (N3) cannot observe swarm-run Codex subprocesses or worktree writer subagents",
      "timestamp": "2026-04-24T18:52:54Z"
    },
    {
      "category": "bug",
      "consensus_level": null,
      "consensus_score": null,
      "detected_by": [
        "claude"
      ],
      "duplicate_cluster_id": null,
      "file_path": "plans/swarm-do-1.12-orchestration-friction-fixes.md",
      "finding_id": "01KQ0DCXZDVGHF0JFF8BPHMGAB",
      "issue_id": "mco-1.12-00",
      "line_end": 284,
      "line_start": 284,
      "provider": "mco",
      "provider_count": 1,
      "provider_error_class": null,
      "role": "agent-codex-review",
      "run_id": "MCO_112_00",
      "schema_ok": true,
      "severity": "high",
      "short_summary": "artifact path is asserted without matching the existing telemetry layout",
      "source_artifact_path": "/Users/mstefanko/.claude/plugins/marketplaces/mstefanko-plugins/swarm-do/data/mco-spike/1.12/results/01-context-resilience.md/mco.stdout.json",
      "stable_finding_hash_v1": "0df097a5def2853fb3850226a79644292b39367e7d55cbb38d9e021c7a773774",
      "summary": "Checkpoint artifact path is asserted without matching the existing telemetry layout",
      "timestamp": "2026-04-24T18:52:54Z"
    },
    {
      "category": "security",
      "consensus_level": null,
      "consensus_score": null,
      "detected_by": [
        "claude"
      ],
      "duplicate_cluster_id": null,
      "file_path": "plans/swarm-do-1.12-orchestration-friction-fixes.md",
      "finding_id": "01KQ0DCXZJRK4E0VKW7JK677QP",
      "issue_id": "mco-1.12-00",
      "line_end": 389,
      "line_start": 389,
      "provider": "mco",
      "provider_count": 1,
      "provider_error_class": null,
      "role": "agent-codex-review",
      "run_id": "MCO_112_00",
      "schema_ok": true,
      "severity": "high",
      "short_summary": "Auto-merge default for swarm resume on drifted state is an unsafe default after a crash",